{
  "$schema": "https://pptx.dev/schema/opf-chart/v1",
  "id": "treemap-3x",
  "name": "TREEMAP_3X",
  "label": "Treemap 3x",
  "type": "TREEMAP",
  "categories": 16,
  "columns": [
    "Level1",
    "Level2",
    "Level3",
    "Series1"
  ],
  "group": "Treemap",
  "groupSort": 8,
  "series": 1,
  "seriesGroups": 1,
  "slideNumber": 45,
  "useSecondaryCategories": false,
  "workbookRange": "Sheet1!$A$1:$Q$4",
  "complexity": "hierarchical",
  "dataColumns": [
    {
      "name": "Level1",
      "role": "categoryLabel",
      "type": "string",
      "position": "row0_col0"
    },
    {
      "name": "Level2",
      "role": "helper",
      "type": "number",
      "position": "row1_col0"
    },
    {
      "name": "Level3",
      "role": "series",
      "type": "number",
      "position": "row2_col0"
    },
    {
      "name": "Series1",
      "role": "series",
      "type": "number",
      "position": "row3_col0"
    }
  ],
  "sampleData": {
    "headers": [
      "Level1",
      "Level2",
      "Level3",
      "Value"
    ],
    "rows": [
      [
        "North",
        "Tech",
        "Software",
        58
      ],
      [
        "North",
        "Tech",
        "Hardware",
        95
      ],
      [
        "North",
        "Finance",
        "Banking",
        74
      ],
      [
        "North",
        "Finance",
        "Insurance",
        59
      ],
      [
        "South",
        "Tech",
        "Software",
        92
      ],
      [
        "South",
        "Tech",
        "Hardware",
        99
      ],
      [
        "South",
        "Finance",
        "Banking",
        27
      ],
      [
        "South",
        "Finance",
        "Insurance",
        98
      ]
    ]
  },
  "preview": {
    "src": "https://xano.storyd.ai/vault/PMfrMmjB/Havuj92YnuUI-ns8woQm994uKEM/uLIixg../045_TREEMAP_3X.png",
    "vectorSrc": "https://xano.storyd.ai/vault/PMfrMmjB/7JascgtWR_ar2vDAbstdsvkmK40/5GFTTA../045_TREEMAP_3X.svg"
  }
}
