{
  "$schema": "https://pptx.dev/schema/opf-chart/v1",
  "id": "dot-plot",
  "name": "DOT_PLOT",
  "label": "Dot Plot",
  "type": "SERIES_OF_MIXED_TYPES",
  "categories": 8,
  "columns": [
    "2023"
  ],
  "group": "XY (Scatter)",
  "groupSort": 6,
  "series": 1,
  "seriesGroups": 2,
  "slideNumber": 34,
  "useSecondaryCategories": false,
  "workbookRange": "Sheet1!$A$1:$I$2",
  "complexity": "calculated",
  "dataColumns": [
    {
      "name": "2023",
      "role": "categoryLabel",
      "type": "string",
      "position": "row0_col0"
    },
    {
      "name": "Spacing 1",
      "role": "helper",
      "type": "number",
      "position": "row1_col0"
    }
  ],
  "helperColumns": [
    "Spacing 1"
  ],
  "sampleData": {
    "headers": [
      "Series",
      "Item 1",
      "Item 2",
      "Item 3",
      "Item 4",
      "Item 5",
      "Item 6",
      "Item 7",
      "Item 8"
    ],
    "rows": [
      [
        "2020",
        691807,
        128418,
        188025,
        549433,
        242291,
        584125,
        290556,
        152727
      ]
    ]
  },
  "preview": {
    "src": "https://xano.storyd.ai/vault/PMfrMmjB/SSnr8AtZfFkMG2COAkf9bHO9dho/SqiRuQ../034_DOT_PLOT.png",
    "vectorSrc": "https://xano.storyd.ai/vault/PMfrMmjB/Hb5_aFCbYLZ7CXAI40W-zzSth8g/-VA7GQ../034_DOT_PLOT.svg"
  }
}
