{
  "$schema": "https://pptx.dev/schema/opf-chart/v1",
  "id": "doughnut",
  "name": "DOUGHNUT",
  "label": "Doughnut",
  "type": "DOUGHNUT",
  "categories": 2,
  "columns": [
    "Segment",
    "Value 1"
  ],
  "group": "Pie",
  "groupSort": 3,
  "series": 1,
  "seriesGroups": 1,
  "slideNumber": 20,
  "useSecondaryCategories": false,
  "workbookRange": "Sheet1!$A$1:$C$2",
  "complexity": "simple",
  "dataColumns": [
    {
      "name": "Segment",
      "role": "categoryLabel",
      "type": "string",
      "position": "row0_col0"
    },
    {
      "name": "Value 1",
      "role": "series",
      "type": "number",
      "position": "row1_col0"
    }
  ],
  "sampleData": {
    "headers": [
      "Segment",
      "Q1 2024",
      "Q2 2024"
    ],
    "rows": [
      [
        "Value 1",
        63264,
        91351
      ]
    ]
  },
  "preview": {
    "src": "https://xano.storyd.ai/vault/PMfrMmjB/ISvcVGnrmAw4ldIiRvjOL5osfOM/us5UDQ../020_DOUGHNUT.png",
    "vectorSrc": "https://xano.storyd.ai/vault/PMfrMmjB/En1YTSeQ6GfXRp3INtaKtCwvXwU/oePh_g../020_DOUGHNUT.svg"
  }
}
