{
  "$schema": "https://pptx.dev/schema/opf-chart/v1",
  "id": "line-with-markers",
  "name": "LINE_WITH_MARKERS",
  "label": "Line with Markers",
  "type": "LINE_WITH_MARKERS",
  "categories": 12,
  "columns": [
    "Series 1",
    "Value"
  ],
  "group": "Line",
  "groupSort": 2,
  "series": 1,
  "seriesGroups": 1,
  "slideNumber": 10,
  "useSecondaryCategories": false,
  "workbookRange": "Sheet1!$A$1:$M$2",
  "complexity": "simple",
  "dataColumns": [
    {
      "name": "Series 1",
      "role": "categoryLabel",
      "type": "string",
      "position": "row0_col0"
    },
    {
      "name": "Value",
      "role": "series",
      "type": "number",
      "position": "row1_col0"
    }
  ],
  "sampleData": {
    "headers": [
      "Series 1",
      "Q1 2024",
      "Q2 2024",
      "Q3 2024",
      "Q4 2024",
      "Q1 2025",
      "Q2 2025",
      "Q3 2025",
      "Q4 2025",
      "Q1 2026",
      "Q2 2026",
      "Q3 2026",
      "Q4 2026"
    ],
    "rows": [
      [
        "Value",
        19071,
        79822,
        26483,
        26828,
        96474,
        72296,
        82063,
        31643,
        44741,
        79163,
        89507,
        65461
      ]
    ]
  },
  "preview": {
    "src": "https://xano.storyd.ai/vault/PMfrMmjB/r9w3bEjEdSEj-F_-VXjQofkrx08/CwvMFg../010_LINE_WITH_MARKERS.png",
    "vectorSrc": "https://xano.storyd.ai/vault/PMfrMmjB/NWp6qvmhDFgQhlbRwlqxCCNlULg/7HS3AA../010_LINE_WITH_MARKERS.svg"
  }
}
