{
  "$schema": "https://pptx.dev/schema/opf-chart/v1",
  "id": "100pct-stacked-bar-2x",
  "name": "100PCT_STACKED_BAR_2X",
  "label": "100% Stacked Bar 2x",
  "type": "PERCENTS_STACKED_BAR",
  "categories": 6,
  "columns": [
    "Series 1",
    "Value 1",
    "Value 2"
  ],
  "group": "Bar",
  "groupSort": 4,
  "series": 2,
  "seriesGroups": 1,
  "slideNumber": 25,
  "useSecondaryCategories": false,
  "workbookRange": "Sheet1!$A$1:$G$3",
  "complexity": "simple",
  "dataColumns": [
    {
      "name": "Series 1",
      "role": "categoryLabel",
      "type": "string",
      "position": "row0_col0"
    },
    {
      "name": "Value 1",
      "role": "series",
      "type": "number",
      "position": "row1_col0"
    },
    {
      "name": "Value 2",
      "role": "series",
      "type": "number",
      "position": "row2_col0"
    }
  ],
  "sampleData": {
    "headers": [
      "Series 1",
      "Q1 2024",
      "Q2 2024",
      "Q3 2024",
      "Q4 2024",
      "Q1 2025",
      "Q2 2025"
    ],
    "rows": [
      [
        "Value 1",
        66959,
        55309,
        51114,
        67199,
        89457,
        77033
      ],
      [
        "Value 2",
        25157,
        60488,
        85574,
        34914,
        43386,
        15817
      ]
    ]
  },
  "preview": {
    "src": "https://xano.storyd.ai/vault/PMfrMmjB/7kZ1lYfUPkdcvw_lN0SmmXYM0gI/1EwSUQ../025_100PCT_STACKED_BAR_2X.png",
    "vectorSrc": "https://xano.storyd.ai/vault/PMfrMmjB/1M3NxpKSjsRQt0KNKdjGLAkU868/_rFoSw../025_100PCT_STACKED_BAR_2X.svg"
  }
}
