{
  "$schema": "https://pptx.dev/schema/opf-chart/v1",
  "id": "stacked-line-with-markers-2x",
  "name": "STACKED_LINE_WITH_MARKERS_2X",
  "label": "Stacked Line with Markers 2x",
  "type": "STACKED_LINE_WITH_MARKERS",
  "categories": 12,
  "columns": [
    "Series 1",
    "Value 1",
    "Value 2"
  ],
  "group": "Line",
  "groupSort": 2,
  "series": 2,
  "seriesGroups": 1,
  "slideNumber": 14,
  "useSecondaryCategories": false,
  "workbookRange": "Sheet1!$A$1:$M$3",
  "complexity": "simple",
  "dataColumns": [
    {
      "name": "Series 1",
      "role": "categoryLabel",
      "type": "string",
      "position": "row0_col0"
    },
    {
      "name": "Value 1",
      "role": "series",
      "type": "number",
      "position": "row1_col0"
    },
    {
      "name": "Value 2",
      "role": "series",
      "type": "number",
      "position": "row2_col0"
    }
  ],
  "sampleData": {
    "headers": [
      "Series 1",
      "Q1 2024",
      "Q2 2024",
      "Q3 2024",
      "Q4 2024",
      "Q1 2025",
      "Q2 2025",
      "Q3 2025",
      "Q4 2025",
      "Q1 2026",
      "Q2 2026",
      "Q3 2026",
      "Q4 2026"
    ],
    "rows": [
      [
        "Value 1",
        70637,
        42742,
        19880,
        68082,
        82132,
        22833,
        16630,
        95477,
        80855,
        11934,
        22224,
        40982
      ],
      [
        "Value 2",
        31798,
        63269,
        73653,
        73092,
        38016,
        62565,
        17685,
        31579,
        59672,
        10282,
        61173,
        44760
      ]
    ]
  },
  "preview": {
    "src": "https://xano.storyd.ai/vault/PMfrMmjB/8N94mNLMNo_91CGmS-WnFodyNf4/ZJlnRg../014_STACKED_LINE_WITH_MARKERS_2X.png",
    "vectorSrc": "https://xano.storyd.ai/vault/PMfrMmjB/lGNKDQha1V4THA4lWjE1kRXKWVk/5jThAQ../014_STACKED_LINE_WITH_MARKERS_2X.svg"
  }
}
