{
  "$schema": "https://pptx.dev/schema/opf-chart/v1",
  "id": "100pct-bullet-bar-3x",
  "name": "100PCT_BULLET_BAR_3X",
  "label": "100% Bullet Bar 3x",
  "type": "SERIES_OF_MIXED_TYPES",
  "categories": 8,
  "columns": [
    "ValueCategory",
    "Alpha",
    "Beta",
    "Gamma"
  ],
  "group": "Bullet",
  "groupSort": 10,
  "series": 3,
  "seriesGroups": 2,
  "slideNumber": 59,
  "useSecondaryCategories": true,
  "workbookRange": "Sheet1!$A$1:$I$4",
  "complexity": "calculated",
  "dataColumns": [
    {
      "name": "ValueCategory",
      "role": "categoryLabel",
      "type": "string",
      "position": "row0_col0"
    },
    {
      "name": "Alpha",
      "role": "series",
      "type": "number",
      "position": "row1_col0"
    },
    {
      "name": "Beta",
      "role": "series",
      "type": "number",
      "position": "row2_col0"
    },
    {
      "name": "Gamma",
      "role": "series",
      "type": "number",
      "position": "row3_col0"
    }
  ],
  "helperColumns": [
    "Excellent",
    "Good",
    "Fair",
    "Poor",
    "Actual %",
    "Target %"
  ],
  "sampleData": {
    "headers": [
      "ValueCategory",
      "Actual",
      "Target"
    ],
    "rows": [
      [
        "Metric 1",
        95,
        75
      ],
      [
        "Metric 2",
        95,
        88
      ],
      [
        "Metric 3",
        65,
        82
      ]
    ]
  },
  "preview": {
    "src": "https://xano.storyd.ai/vault/PMfrMmjB/fVyKaNWJONueZSAG8UEBupriJPM/xmd5qw../059_100PCT_BULLET_BAR_3X.png",
    "vectorSrc": "https://xano.storyd.ai/vault/PMfrMmjB/1BjkKRiWkbivF2IRSuVVPwaefh0/wVaQGg../059_100PCT_BULLET_BAR_3X.svg"
  }
}
