{
  "$schema": "https://pptx.dev/schema/opf-chart/v1",
  "id": "column",
  "name": "COLUMN",
  "label": "Column",
  "type": "CLUSTERED_COLUMN",
  "categories": 8,
  "columns": [
    "Series 1",
    "Value"
  ],
  "group": "Column",
  "groupSort": 1,
  "series": 1,
  "seriesGroups": 1,
  "slideNumber": 1,
  "useSecondaryCategories": false,
  "workbookRange": "Sheet1!$A$1:$I$2",
  "complexity": "simple",
  "dataColumns": [
    {
      "name": "Series 1",
      "role": "categoryLabel",
      "type": "string",
      "position": "row0_col0"
    },
    {
      "name": "Value",
      "role": "series",
      "type": "number",
      "position": "row1_col0"
    }
  ],
  "sampleData": {
    "headers": [
      "Series 1",
      "Q1 2024",
      "Q2 2024",
      "Q3 2024",
      "Q4 2024",
      "Q1 2025",
      "Q2 2025",
      "Q3 2025",
      "Q4 2025"
    ],
    "rows": [
      [
        "Value",
        93810,
        24592,
        13278,
        46048,
        42098,
        39256,
        28289,
        23434
      ]
    ]
  },
  "preview": {
    "src": "https://xano.storyd.ai/vault/PMfrMmjB/hLMSN_VxHD-VWwbmnPQ8YDI0Owo/-vdLUg../001_COLUMN.png",
    "vectorSrc": "https://xano.storyd.ai/vault/PMfrMmjB/Ng_HMD2agoHyKmH_uq5Yzo36zeA/_SYKfg../001_COLUMN.svg"
  }
}
