{
  "$schema": "https://pptx.dev/schema/opf-chart/v1",
  "id": "100pct-bullet-column",
  "name": "100PCT_BULLET_COLUMN",
  "label": "100% Bullet Column",
  "type": "SERIES_OF_MIXED_TYPES",
  "categories": 8,
  "columns": [
    "ValueCategory",
    "This Year"
  ],
  "group": "Bullet",
  "groupSort": 10,
  "series": 1,
  "seriesGroups": 2,
  "slideNumber": 51,
  "useSecondaryCategories": false,
  "workbookRange": "Sheet1!$A$1:$I$2",
  "complexity": "calculated",
  "dataColumns": [
    {
      "name": "ValueCategory",
      "role": "categoryLabel",
      "type": "string",
      "position": "row0_col0"
    },
    {
      "name": "This Year",
      "role": "series",
      "type": "number",
      "position": "row1_col0"
    }
  ],
  "helperColumns": [
    "Excellent",
    "Good",
    "Fair",
    "Poor",
    "Actual %",
    "Target %"
  ],
  "sampleData": {
    "headers": [
      "ValueCategory",
      "Actual",
      "Target"
    ],
    "rows": [
      [
        "Metric 1",
        60,
        96
      ]
    ]
  },
  "preview": {
    "src": "https://xano.storyd.ai/vault/PMfrMmjB/BvXZnEz7Iyu6Cradzhb_jMozYMg/1W8wQA../051_100PCT_BULLET_COLUMN.png",
    "vectorSrc": "https://xano.storyd.ai/vault/PMfrMmjB/yk3jK8dZRXtuldJXGEIzv_KpH1k/DvGjxQ../051_100PCT_BULLET_COLUMN.svg"
  }
}
