{
  "$schema": "https://pptx.dev/schema/opf-chart/v1",
  "id": "bullet-bar",
  "name": "BULLET_BAR",
  "label": "Bullet Bar",
  "type": "SERIES_OF_MIXED_TYPES",
  "categories": 6,
  "columns": [
    "ValueCategory",
    "Alpha"
  ],
  "group": "Bullet",
  "groupSort": 10,
  "series": 1,
  "seriesGroups": 2,
  "slideNumber": 54,
  "useSecondaryCategories": true,
  "workbookRange": "Sheet1!$A$1:$G$2",
  "complexity": "calculated",
  "dataColumns": [
    {
      "name": "ValueCategory",
      "role": "categoryLabel",
      "type": "string",
      "position": "row0_col0"
    },
    {
      "name": "Alpha",
      "role": "series",
      "type": "number",
      "position": "row1_col0"
    }
  ],
  "helperColumns": [
    "Excellent",
    "Good",
    "Fair",
    "Poor"
  ],
  "sampleData": {
    "headers": [
      "ValueCategory",
      "Actual",
      "Target"
    ],
    "rows": [
      [
        "Metric 1",
        88,
        99
      ]
    ]
  },
  "preview": {
    "src": "https://xano.storyd.ai/vault/PMfrMmjB/GJSPKhA0MZfzQAvgLhRB7jxNbRA/od7CtA../054_BULLET_BAR.png",
    "vectorSrc": "https://xano.storyd.ai/vault/PMfrMmjB/OpNbpbNbhCiwY6wOOagVdxbW65Q/9qIRGA../054_BULLET_BAR.svg"
  }
}
